Association,Resource Name,Link to Resource
Regional Resources,Seattle Mutual Aid Form (Request),https://docs.google.com/forms/d/e/1FAIpQLSdgbAX21UARi98rKKX6b6mpvpVHW4b63F2n2beJlHielcdU2Q/viewform
Regional Resources,Seattle Mutual Aid Form (Volunteer),https://www.gofundme.com/f/covid19-survival-fund-for-the-people
Regional Resources,Tacoma Mutual Aid Facebook Page,https://www.facebook.com/TacomaMutualAidCollective/
Regional Resources,Olympia Mutual Aid Form,https://docs.google.com/forms/d/e/1FAIpQLSegS8HmpiafpmTs5sqwZoDtUljxcEVuO2i9aUyBpJhqaUw7Mg/viewform
Regional Resources,Olympia Medical Supply Common Stash,https://www.commonstash.org/
Western Washington University,"POC, Queer, and Disabled Student Mutual Aid Fund",https://www.instagram.com/wwucommunityaid/
